{"$schema":"https://json-schema.org/draft/2020-12/schema","$id":"https://kenigevents.ru/contracts/region-talk/publisher-profile-enrichment.v1.schema.json","title":"Region Talk reusable publisher profile enrichment v1","type":"object","additionalProperties":false,"required":["schema_version","run","profiles","candidate_corrections","run_uncertainties"],"properties":{"schema_version":{"const":"region_talk_publisher_profile_enrichment.v1"},"run":{"$ref":"#/$defs/run"},"profiles":{"type":"array","minItems":1,"items":{"$ref":"#/$defs/profile"}},"candidate_corrections":{"type":"array","items":{"$ref":"#/$defs/candidateCorrection"}},"run_uncertainties":{"type":"array","items":{"type":"string","maxLength":1000}}},"$defs":{"url":{"type":"string","format":"uri","pattern":"^https?://","maxLength":2000},"evidenceRefs":{"type":"array","uniqueItems":true,"items":{"type":"string","pattern":"^[A-Za-z0-9._:-]{1,100}$"}},"run":{"type":"object","additionalProperties":false,"required":["request_id","executed_at","purpose","source_count","linked_candidate_count","research_policy"],"properties":{"request_id":{"type":"string","minLength":1,"maxLength":180},"executed_at":{"type":"string","format":"date-time"},"purpose":{"type":"string","minLength":1,"maxLength":1000},"source_count":{"type":"integer","minimum":1},"linked_candidate_count":{"type":"integer","minimum":1},"research_policy":{"type":"string","minLength":1,"maxLength":1000}}},"audience":{"type":"object","additionalProperties":false,"required":["label","basis","evidence_refs"],"properties":{"label":{"type":"string","minLength":1,"maxLength":300},"basis":{"enum":["explicit","cautious_inference"]},"evidence_refs":{"$ref":"#/$defs/evidenceRefs"}}},"claim":{"type":"object","additionalProperties":false,"required":["text","evidence_refs"],"properties":{"text":{"type":"string","minLength":1,"maxLength":800},"evidence_refs":{"$ref":"#/$defs/evidenceRefs"}}},"operatingModel":{"type":"object","additionalProperties":false,"required":["languages","publication_frequency","access_model","review_model","editorial_selection"],"properties":{"languages":{"type":"array","minItems":1,"uniqueItems":true,"items":{"type":"string","pattern":"^[a-z]{2,3}$"}},"publication_frequency":{"type":["string","null"],"maxLength":300},"access_model":{"enum":["open","mixed","paywalled","unknown"]},"review_model":{"type":["string","null"],"maxLength":1000},"editorial_selection":{"type":["string","null"],"maxLength":1000}}},"localityGuard":{"type":"object","additionalProperties":false,"required":["brand_scope_basis","article_producer_check","local_edition_policy","evidence_refs"],"properties":{"brand_scope_basis":{"type":"string","minLength":1,"maxLength":1000},"article_producer_check":{"type":"string","minLength":1,"maxLength":1000},"local_edition_policy":{"type":"string","minLength":1,"maxLength":1000},"evidence_refs":{"$ref":"#/$defs/evidenceRefs"}}},"copyProjection":{"type":"object","additionalProperties":false,"required":["long_profile","short_reader_brief","cta_label","public_copy_eligibility","do_not_say"],"properties":{"long_profile":{"type":"string","minLength":200,"maxLength":2600},"short_reader_brief":{"type":"string","minLength":180,"maxLength":900},"cta_label":{"type":"string","minLength":1,"maxLength":240},"public_copy_eligibility":{"enum":["allowed","candidate_specific_review","blocked"]},"do_not_say":{"type":"array","uniqueItems":true,"items":{"type":"string","maxLength":300}}}},"evidence":{"type":"object","additionalProperties":false,"required":["evidence_id","supports","url","page_role","retrieved_at","location_hint","paraphrase"],"properties":{"evidence_id":{"type":"string","pattern":"^[A-Za-z0-9._:-]{1,100}$"},"supports":{"type":"array","minItems":1,"uniqueItems":true,"items":{"type":"string","maxLength":120}},"url":{"$ref":"#/$defs/url"},"page_role":{"enum":["source_about","editorial_policy","peer_review_policy","source_navigation","source_archive","primary_article","local_edition_or_byline","official_registration","other"]},"retrieved_at":{"type":"string","format":"date-time"},"location_hint":{"type":"string","maxLength":400},"paraphrase":{"type":"string","minLength":1,"maxLength":1000}}},"uncertainty":{"type":"object","additionalProperties":false,"required":["field","severity","reason","required_check","evidence_refs"],"properties":{"field":{"type":"string","maxLength":220},"severity":{"enum":["low","medium","high"]},"reason":{"type":"string","maxLength":1000},"required_check":{"type":"string","maxLength":1000},"evidence_refs":{"$ref":"#/$defs/evidenceRefs"}}},"profile":{"type":"object","additionalProperties":false,"required":["canonical_source_key","source_name","aliases","canonical_url","source_domain","entity_type","scope","profile_status","identity_summary","intended_audiences","editorial_subjects","recurring_formats","distinctive_value","operating_model","locality_guard","copy_projection","linked_candidate_urls","evidence","uncertainties"],"properties":{"canonical_source_key":{"type":"string","pattern":"^domain:[a-z0-9.-]+$","maxLength":300},"source_name":{"type":"string","minLength":1,"maxLength":300},"aliases":{"type":"array","uniqueItems":true,"items":{"type":"string","maxLength":300}},"canonical_url":{"$ref":"#/$defs/url"},"source_domain":{"type":"string","minLength":1,"maxLength":255},"entity_type":{"enum":["journal","media_brand","professional_platform","cultural_platform","other"]},"scope":{"enum":["external","mixed","regional","unknown"]},"profile_status":{"enum":["ready","needs_review","blocked"]},"identity_summary":{"type":"string","minLength":1,"maxLength":1200},"intended_audiences":{"type":"array","minItems":1,"items":{"$ref":"#/$defs/audience"}},"editorial_subjects":{"type":"array","minItems":1,"uniqueItems":true,"items":{"type":"string","maxLength":240}},"recurring_formats":{"type":"array","minItems":1,"uniqueItems":true,"items":{"type":"string","maxLength":240}},"distinctive_value":{"type":"array","minItems":1,"items":{"$ref":"#/$defs/claim"}},"operating_model":{"$ref":"#/$defs/operatingModel"},"locality_guard":{"$ref":"#/$defs/localityGuard"},"copy_projection":{"$ref":"#/$defs/copyProjection"},"linked_candidate_urls":{"type":"array","minItems":1,"uniqueItems":true,"items":{"$ref":"#/$defs/url"}},"evidence":{"type":"array","minItems":2,"items":{"$ref":"#/$defs/evidence"}},"uncertainties":{"type":"array","items":{"$ref":"#/$defs/uncertainty"}}}},"candidateCorrection":{"type":"object","additionalProperties":false,"required":["canonical_url","linked_source_key","observed_surface","recommended_action","reason_codes","reason_short","evidence_refs","requires_live_ydb_revalidation"],"properties":{"canonical_url":{"$ref":"#/$defs/url"},"linked_source_key":{"type":"string","pattern":"^domain:[a-z0-9.-]+$","maxLength":300},"observed_surface":{"type":"string","minLength":1,"maxLength":500},"recommended_action":{"enum":["retain_and_enrich","manual_research_review","re_adjudicate_externality","block"]},"reason_codes":{"type":"array","minItems":1,"uniqueItems":true,"items":{"type":"string","maxLength":120}},"reason_short":{"type":"string","minLength":1,"maxLength":1200},"evidence_refs":{"$ref":"#/$defs/evidenceRefs"},"requires_live_ydb_revalidation":{"type":"boolean"}}}}}
