{"schema_version":"region_talk_publisher_profile_enrichment.v1","run":{"request_id":"region-talk-publisher-profile-enrichment-2026-08-02-081000-archi-ru","executed_at":"2026-08-02T08:10:00Z","purpose":"Backfill reusable, evidence-grounded publisher dossiers for the external publication sources observed in the Region Talk candidate-copy review. The package enriches source identity separately from article summaries and records one candidate-level externality correction; it grants no publication permission.","source_count":1,"linked_candidate_count":1,"research_policy":"Use official source About, editorial-policy, review-policy, navigation/archive and exact article/byline pages. Distinguish the global brand from the team or regional edition that produced the particular article. Avoid prestige and popularity claims in public copy."},"profiles":[{"canonical_source_key":"domain:archi.ru","source_name":"Архи.ру","aliases":["Archi.ru","archi.ru"],"canonical_url":"https://archi.ru/","source_domain":"archi.ru","entity_type":"professional_platform","scope":"external","profile_status":"ready","identity_summary":"Независимое профессиональное интернет-издание и справочная платформа об архитектуре, градостроительстве и сохранении наследия. Публикует российские и международные проекты, авторские обзоры, материалы о конкурсах и событиях, пресс-дайджесты, книги, журналы и научные статьи; Калининград — один из множества географических сюжетов.","intended_audiences":[{"label":"архитекторы, градостроители, реставраторы и другие профессионалы среды","basis":"explicit","evidence_refs":["archi.contacts"]},{"label":"исследователи, студенты профильных направлений и читатели, которым важно понимать замысел и контекст архитектурных проектов","basis":"cautious_inference","evidence_refs":["archi.contacts","archi.navigation"]}],"editorial_subjects":["архитектура","градостроительство","реставрация и сохранение наследия","общественные пространства","профессиональные конкурсы и события","архитектурные книги, журналы и исследования"],"recurring_formats":["авторские обзоры и репортажи","каталог проектов и построек","новости и пресс-дайджест","календарь конкурсов и событий","публикации книг, журналов и научных статей","профили архитекторов и мастерских"],"distinctive_value":[{"text":"Соединяет редакционные разборы с систематизированным профессиональным каталогом проектов, авторов, конкурсов и публикаций.","evidence_refs":["archi.navigation","archi.contacts"]},{"text":"Редакция рассматривает присланные проекты и самостоятельно решает, что попадет только в каталог, а что получит обзор, рецензию или репортаж.","evidence_refs":["archi.contacts"]}],"operating_model":{"languages":["ru","en"],"publication_frequency":"постоянное онлайн-обновление","access_model":"open","review_model":null,"editorial_selection":"Проекты и события проходят редакционный отбор; решение о более глубоком авторском материале принимается исходя из профильности и ценности."},"locality_guard":{"brand_scope_basis":"Платформа освещает архитектуру России и других стран и не имеет калининградского редакционного ядра.","article_producer_check":"Связанная статья подписана автором Архи.ру Алёной Кузнецовой и опубликована в общем разделе издания, а не в локальной калининградской редакции.","local_edition_policy":"Для каждого нового материала всё равно проверять byline и раздел: сам бренд не должен автоматически доказывать внешность конкретной публикации.","evidence_refs":["archi.navigation","archi.article"]},"copy_projection":{"long_profile":"Архи.ру — независимое профессиональное интернет-издание об архитектуре, градостроительстве и сохранении наследия. Оно сочетает авторские обзоры и репортажи с каталогом проектов, конкурсами, событиями, книгами и научными публикациями. Редакция сама отбирает проекты и решает, какие из них требуют не только справочной карточки, но и отдельного разбора. Поэтому источник особенно полезен, когда хочется понять профессиональный замысел здания или экспозиции, а не ограничиться внешним впечатлением.","short_reader_brief":"Архи.ру — профессиональное издание об архитектуре, градостроительстве и наследии. Оно сочетает авторские обзоры с каталогом проектов и помогает понять не только внешний вид здания, но и замысел архитекторов и дизайнеров.","cta_label":"Подробнее — в статье на Архи.ру","public_copy_eligibility":"allowed","do_not_say":["ведущее издание","самое авторитетное архитектурное медиа","уникальный источник"]},"linked_candidate_urls":["https://archi.ru/russia/101203/vsya-mudrost-okeana"],"evidence":[{"evidence_id":"archi.navigation","supports":["publisher.identity","publisher.editorial_scope","publisher.formats","publisher.audience","publisher.locality"],"url":"https://archi.ru/en/about.html","page_role":"source_about","retrieved_at":"2026-08-02T08:10:00Z","location_hint":"описание издания и перечень постоянных разделов","paraphrase":"Официальная страница описывает Архи.ру как независимое онлайн-издание об архитектуре, градостроительстве и наследии с российским и международным охватом, новостями, проектами, авторами, конкурсами, событиями и справочными разделами."},{"evidence_id":"archi.contacts","supports":["publisher.editorial_scope","publisher.formats","publisher.distinctive_value","publisher.policy","publisher.audience","publisher.cta"],"url":"https://archi.ru/contacts","page_role":"editorial_policy","retrieved_at":"2026-08-02T08:10:00Z","location_hint":"разделы «Проекты», «Конкурсы и события», «Пресса, книги, журналы, научные статьи»","paraphrase":"Редакция рассматривает проекты и сама выбирает формат публикации, принимает профильные события, книги, журналы и исследования, а решение об обзоре, рецензии или репортаже принимает по ценности и профильности материалов."},{"evidence_id":"archi.article","supports":["candidate.article","candidate.byline","publisher.locality"],"url":"https://archi.ru/russia/101203/vsya-mudrost-okeana","page_role":"primary_article","retrieved_at":"2026-08-02T08:10:00Z","location_hint":"заголовок, автор, дата, рубрики и основной текст","paraphrase":"Материал Алёны Кузнецовой от 27 августа 2025 года — авторский обзор архитектуры и экспозиции «Планеты Океан» с профессиональными комментариями и подробностями проекта."}],"uncertainties":[{"field":"operating_model.languages","severity":"low","reason":"У платформы есть англоязычный интерфейс и международный охват, но основной поток связанных с российскими проектами материалов русскоязычный.","required_check":"Не обещать читателю полную двуязычность каждого раздела.","evidence_refs":["archi.navigation"]}]}],"candidate_corrections":[{"canonical_url":"https://archi.ru/russia/101203/vsya-mudrost-okeana","linked_source_key":"domain:archi.ru","observed_surface":"Region Talk operator-review candidate copy","recommended_action":"retain_and_enrich","reason_codes":["publisher_profile_ready","external_professional_platform","article_byline_verified"],"reason_short":"Материал может остаться кандидатом; Writer следует передать готовый профиль Архи.ру и построить первый абзац как хук статьи плюс одно краткое объяснение ценности издания.","evidence_refs":["archi.navigation","archi.contacts","archi.article"],"requires_live_ydb_revalidation":true}],"run_uncertainties":["Пакет является исследовательским sidecar и не соответствует маске автоматического импорта external-research-result; он не должен сам менять YDB или статусы публикаций.","Профиль «Российской газеты» описывает бренд, но связанный кандидат требует отдельного решения по внешности конкретного материала.","Публичные reader briefs являются модельными проекциями из доказательств; финальный Writer должен повторно проверить длину, хук и соответствие фактам текущей статьи."]}
