{"schema_version":"region_talk_publisher_profile_enrichment.v1","run":{"request_id":"region-talk-publisher-profile-enrichment-2026-08-02-081000-rg-ru","executed_at":"2026-08-02T08:10:00Z","purpose":"Backfill reusable, evidence-grounded publisher dossiers for the external publication sources observed in the Region Talk candidate-copy review. The package enriches source identity separately from article summaries and records one candidate-level externality correction; it grants no publication permission.","source_count":1,"linked_candidate_count":1,"research_policy":"Use official source About, editorial-policy, review-policy, navigation/archive and exact article/byline pages. Distinguish the global brand from the team or regional edition that produced the particular article. Avoid prestige and popularity claims in public copy."},"profiles":[{"canonical_source_key":"domain:rg.ru","source_name":"Российская газета","aliases":["РГ","RG.RU"],"canonical_url":"https://rg.ru/","source_domain":"rg.ru","entity_type":"media_brand","scope":"mixed","profile_status":"needs_review","identity_summary":"Федеральная ежедневная общественно-политическая газета и интернет-портал, учредителем которых является Правительство Российской Федерации. Бренд сочетает федеральные выпуски с региональными разделами и корреспондентской сетью; поэтому внешность должна проверяться не по логотипу, а по конкретному разделу, byline и месту производства материала.","intended_audiences":[{"label":"широкая общероссийская аудитория новостей, общественной повестки и разъяснительных материалов","basis":"explicit","evidence_refs":["rg.print","rg.digital"]},{"label":"читатели региональных выпусков и материалов местных корреспондентов","basis":"cautious_inference","evidence_refs":["rg.article","rg.regional.examples"]}],"editorial_subjects":["общественно-политическая повестка","экономика","законодательство и государственные инициативы","общество и культура","региональная корреспондентская журналистика"],"recurring_formats":["оперативные новости","разъяснительные материалы","аналитика","интервью","федеральные и региональные выпуски","репортажи региональных корреспондентов"],"distinctive_value":[{"text":"Объединяет федеральную повестку с сетью региональных корреспондентов и отдельными региональными разделами.","evidence_refs":["rg.print","rg.digital","rg.article"]},{"text":"Для Region Talk эта структура одновременно полезна и рискованна: федеральный бренд не гарантирует, что конкретный материал создан внешней редакцией.","evidence_refs":["rg.article","rg.regional.examples"]}],"operating_model":{"languages":["ru"],"publication_frequency":"ежедневная газета и постоянно обновляемый интернет-портал","access_model":"mixed","review_model":null,"editorial_selection":null},"locality_guard":{"brand_scope_basis":"Бренд федеральный, но сайт содержит региональные разделы и публикации корреспондентов, явно привязанных к конкретным субъектам.","article_producer_check":"Связанный материал находится в URL-контуре reg-szfo и подписан «Денис Гонтарь (Калининградская область)», то есть произведён локальным региональным корреспондентом о собственном регионе.","local_edition_policy":"По канонической политике Region Talk локальная редакция или региональный корреспондент федеральной сети остаётся региональным источником. Такой материал нельзя считать внешним только по бренду «Российской газеты».","evidence_refs":["rg.article","rg.regional.examples","rg.official"]},"copy_projection":{"long_profile":"«Российская газета» — федеральная ежедневная газета и интернет-портал с общественно-политическими, экономическими, культурными и разъяснительными материалами. Издание одновременно ведёт региональные разделы и использует сеть местных корреспондентов. Поэтому общий профиль бренда нельзя без проверки переносить в Region Talk: для каждого материала необходимо установить, создан ли он внешней федеральной редакцией или местным автором о своём регионе.","short_reader_brief":"«Российская газета» — федеральное издание с собственными региональными разделами и корреспондентами. Для Region Talk этого названия недостаточно: внешность каждого материала нужно подтверждать по разделу и byline.","cta_label":"Подробнее — в материале «Российской газеты»","public_copy_eligibility":"candidate_specific_review","do_not_say":["внешнее федеральное издание","независимый взгляд со стороны","федеральная редакция изучила Калининград"]},"linked_candidate_urls":["https://rg.ru/2025/09/16/reg-szfo/kak-segodnia-vosstanavlivaiut-istoricheskie-doma-i-pamiatniki-v-rossijskom-eksklave.html"],"evidence":[{"evidence_id":"rg.official","supports":["publisher.identity","publisher.operating_model","publisher.ownership"],"url":"https://rgmedia.rg.ru/official","page_role":"official_registration","retrieved_at":"2026-08-02T08:10:00Z","location_hint":"официальные сведения об учредителе и регистрации портала","paraphrase":"Официальная страница сообщает, что учредителем «Российской газеты» является Правительство Российской Федерации, а интернет-портал зарегистрирован как сетевое издание."},{"evidence_id":"rg.print","supports":["publisher.identity","publisher.audience","publisher.formats","publisher.frequency"],"url":"https://rgmedia.rg.ru/print-media","page_role":"source_about","retrieved_at":"2026-08-02T08:10:00Z","location_hint":"описание ежедневной газеты и еженедельного выпуска","paraphrase":"Медиахолдинг описывает «Российскую газету» как ежедневное общественно-политическое издание, а «РГ — Неделю» — как еженедельный разъяснительный выпуск."},{"evidence_id":"rg.digital","supports":["publisher.identity","publisher.audience","publisher.formats","publisher.operating_model"],"url":"https://rgmedia.rg.ru/digital-media","page_role":"source_about","retrieved_at":"2026-08-02T08:10:00Z","location_hint":"описание портала RG.RU","paraphrase":"Официальная страница описывает RG.RU как постоянно действующий интернет-портал «Российской газеты»."},{"evidence_id":"rg.article","supports":["candidate.article","candidate.byline","publisher.locality","candidate.externality"],"url":"https://rg.ru/2025/09/16/reg-szfo/kak-segodnia-vosstanavlivaiut-istoricheskie-doma-i-pamiatniki-v-rossijskom-eksklave.html","page_role":"local_edition_or_byline","retrieved_at":"2026-08-02T08:10:00Z","location_hint":"URL-раздел, дата и строка автора","paraphrase":"Статья размещена в разделе reg-szfo и подписана Денисом Гонтарём с явной пометой «Калининградская область»."},{"evidence_id":"rg.regional.examples","supports":["publisher.locality","publisher.formats","candidate.externality"],"url":"https://rg.ru/2025/03/12/reg-szfo/v-rossijskom-eksklave-izmeniat-podhody-k-melioracii.html","page_role":"local_edition_or_byline","retrieved_at":"2026-08-02T08:10:00Z","location_hint":"другой материал того же автора и регионального раздела","paraphrase":"Другой материал того же автора также находится в reg-szfo и подписан «Денис Гонтарь (Калининградская область)», подтверждая устойчивую локальную корреспондентскую роль."}],"uncertainties":[{"field":"candidate.externality","severity":"high","reason":"Внешняя редакционная обработка конкретной статьи поверх работы местного корреспондента не документирована, тогда как локальность автора и раздела доказана.","required_check":"Перед любым дальнейшим использованием перечитать live YDB row и применить каноническое правило regional/local edition без автоматического повышения.","evidence_refs":["rg.article","rg.regional.examples"]}]}],"candidate_corrections":[{"canonical_url":"https://rg.ru/2025/09/16/reg-szfo/kak-segodnia-vosstanavlivaiut-istoricheskie-doma-i-pamiatniki-v-rossijskom-eksklave.html","linked_source_key":"domain:rg.ru","observed_surface":"Region Talk operator-review candidate copy","recommended_action":"re_adjudicate_externality","reason_codes":["regional_local_edition","local_correspondent","federal_brand_not_sufficient"],"reason_short":"Федеральный бренд не доказывает внешний взгляд: статья опубликована в региональном разделе и подписана корреспондентом из Калининградской области. Live row нужно переоценить по правилу local edition; автоматическое обогащение и перегенерация до этого запрещены.","evidence_refs":["rg.article","rg.regional.examples","rg.official"],"requires_live_ydb_revalidation":true}],"run_uncertainties":["Пакет является исследовательским sidecar и не соответствует маске автоматического импорта external-research-result; он не должен сам менять YDB или статусы публикаций.","Профиль «Российской газеты» описывает бренд, но связанный кандидат требует отдельного решения по внешности конкретного материала.","Публичные reader briefs являются модельными проекциями из доказательств; финальный Writer должен повторно проверить длину, хук и соответствие фактам текущей статьи."]}
